{
  "schemaVersion": "1.0",
  "mode": "session",
  "analysisLevel": "level_1",
  "projectId": 12,
  "protocolId": 25,
  "protocolVersion": "1.0.0",
  "metricIds": [
    "aoi.dwell_time_ms",
    "aoi.ttff_ms",
    "aoi.target_reached",
    "task.accuracy_pct",
    "qc.valid_gaze_pct"
  ],
  "filters": {
    "participantIds": ["P-042"],
    "sessionIds": [105],
    "groupIds": [],
    "conditionIds": [],
    "blockIds": ["main-block"],
    "stimulusIds": ["stimulus-42"],
    "aoiIds": ["aoi-target"],
    "qcMode": "valid_and_borderline",
    "qcChannels": ["task", "gaze"],
    "minValidFraction": 0.7,
    "minSignalConfidence": 0.65,
    "dateFrom": null,
    "dateTo": null,
    "includeIncompleteSessions": false
  }
}
